ID,Name,Role,Quote,Image,Settlement,Species,Age,Gender,Affiliation,Relation to Party,Home Pin Title,Biography,Secrets
lordwhite,Derral Sitsk,Lord White of Brightend,Order and prosperity,./images/lord_white.png,The Alabaster Palace,Human,54,Male,The Crown,Neutral,Alabaster Palace,"Derral Sitsk was the youngest Lord White of Brightend. He distinguished himself at 29 while succesfully protecting the city of Marshes with his troops. His military accomplishments pushed him into politics. <br> Alec Teal's father, Fearn, promoted Sitsk to Lord Commander. A successful campaign to free The city-state Lemerolai got him the title of Lord White after the death of the previous holder.",fdhbizueghb Hzo lmjPIF Hndz njz!rem
hammer_nim,Hammer,Candy maker,Nothing beats a candy! Except a knife,images/hammer.jpg,Cloud District,Dwarf,36,Female,Independent,Ally,Hammer's Candy,"Once a renowned drug dealer/adventurer, she dated Nimo. Now she changed her life and dropped her bad habits... both of them.",
wardenfoll,Ledon Foll,Militia Captain,Brightend is its people,images/ledon_foll.png,Cloud District,Earth Genasi,49,Male,Alabaster Wardens,Ally,Warden Fort,"Grand Warden Foll is well respect amongst his peers, but also revered by most citizens who recognize his dedication to the city. The towering Earth Genasi with granite-grey skin has spent his life in service of Brightend.",
maeravoss,Maera Voss,Scholar,"Knowledge, always",images/maera_voss.png,Cloud District,Madaru,52,Female,Independent,Ally,Hammer's Candy,"An independant scholar, specialized in paleolinguistics and antique history of the Boundless Vale. She was recently asked by Runebridge to translate a magically encrypted tome recovered in a dig site",
mertonlensher,Merton Lensher,Innkeeper,"Drinking when we are not thirsty, eating when not hungry and fucking all year round is what differentiates us from common beasts",images/mertonlensher.png,Cloud District,Human,41,Male,Independent,Neutral,Gilded Goldfinch,"With a broad, inviting smile and striking, heterochromatic eyesď, one clear blue and one green, he commands the polished bar of his prestigious inn. A prosperous figure with a thick mane of greying brown hair and a matching full beard, Merton is dressed in a rugged yet finely detailed leather apron over a rich, gold-embroidered green tunic. His hands rest casually on the dark counter, a symbol of sturdy, welcoming hospitality in his grand, candlelit establishment.",
erikthayne,Erik Thayne,Retired,"""One day at a time""",images/erikthayne.png,Cloud District,Human,63,Male,Independent,Displeased,Thayne Household ,"This former carpenter was married to Elira Thayne, who died in her home in mysterious circumstances. He is left heartbroken. ",
talonoperative,Mystery man,??,??,images/mysteryman.png,Cloud District,Half-elf,??,Male,??,Killed,??,A strange man tailing and taking notes of the party's whereabouts. Killed when trying to escape. ,
